mysql> create table empl (empid int(5), firstName varchar(20), lastName varchar(20), occupation varchar(20), yearlyIncome decimal(20,4), hiredate date);
Query OK, 0 rows affected, 1 warning (0.42 sec)

mysql> insert into empl values(1,"aaa","zzz","Analyst",15000,2020-02-14);
ERROR 1292 (22007): Incorrect date value: '2004' for column 'hiredate' at row 1
mysql> insert into empl values(1,"aaa","zzz","Analyst",15000.00,2020-02-10);
ERROR 1292 (22007): Incorrect date value: '2008' for column 'hiredate' at row 1
mysql> insert into empl values(1,"aaa","zzz","Analyst",15000.00,'2020-02-10');
Query OK, 1 row affected (0.08 sec)

mysql> insert into empl values(2,"bbb","yyy","Programmer",23000.00,'2020-02-14');
Query OK, 1 row affected (0.13 sec)

mysql> insert into empl values(3,"ccc","xxx","Scientist",35000.00,'2019-10-06');
Query OK, 1 row affected (0.09 sec)

mysql> insert into empl values(4,"ddd","www","Doctor",40000.00,'2017-07-29');
Query OK, 1 row affected (0.10 sec)

mysql> insert into empl values(5,"eee","vvv","Engineer",50000.00,'2016-08-01');
Query OK, 1 row affected (0.09 sec)

mysql> select * from empl;
+-------+-----------+----------+------------+--------------+------------+
| empid | firstName | lastName | occupation | yearlyIncome | hiredate   |
+-------+-----------+----------+------------+--------------+------------+
|     1 | aaa       | zzz      | Analyst    |   15000.0000 | 2020-02-10 |
|     2 | bbb       | yyy      | Programmer |   23000.0000 | 2020-02-14 |
|     3 | ccc       | xxx      | Scientist  |   35000.0000 | 2019-10-06 |
|     4 | ddd       | www      | Doctor     |   40000.0000 | 2017-07-29 |
|     5 | eee       | vvv      | Engineer   |   50000.0000 | 2016-08-01 |
+-------+-----------+----------+------------+--------------+------------+
5 rows in set (0.00 sec)

mysql> select * from empl where yearlyIncome > 30000;
+-------+-----------+----------+------------+--------------+------------+
| empid | firstName | lastName | occupation | yearlyIncome | hiredate   |
+-------+-----------+----------+------------+--------------+------------+
|     3 | ccc       | xxx      | Scientist  |   35000.0000 | 2019-10-06 |
|     4 | ddd       | www      | Doctor     |   40000.0000 | 2017-07-29 |
|     5 | eee       | vvv      | Engineer   |   50000.0000 | 2016-08-01 |
+-------+-----------+----------+------------+--------------+------------+
3 rows in set (0.00 sec)

mysql> create table emplo (empid int(5), firstName varchar(20), lastName varchar(20), designation varchar(20), salary decimal(20,4), interviewDate date, reportingDate date, releavingDate date, email varchar(30), mobile int(10), address varchar(50));
Query OK, 0 rows affected, 2 warnings (1.38 sec)

mysql> desc emplo;
+---------------+---------------+------+-----+---------+-------+
| Field         | Type          | Null | Key | Default | Extra |
+---------------+---------------+------+-----+---------+-------+
| empid         | int           | YES  |     | NULL    |       |
| firstName     | varchar(20)   | YES  |     | NULL    |       |
| lastName      | varchar(20)   | YES  |     | NULL    |       |
| designation   | varchar(20)   | YES  |     | NULL    |       |
| salary        | decimal(20,4) | YES  |     | NULL    |       |
| interviewDate | date          | YES  |     | NULL    |       |
| reportingDate | date          | YES  |     | NULL    |       |
| releavingDate | date          | YES  |     | NULL    |       |
| email         | varchar(30)   | YES  |     | NULL    |       |
| mobile        | int           | YES  |     | NULL    |       |
| address       | varchar(50)   | YES  |     | NULL    |       |
+---------------+---------------+------+-----+---------+-------+
11 rows in set (0.08 sec)

mysql> insert into empl values(1,"aaa","zzz","Analyst",15000.00,'2020-02-10','2020-02-14','2020-03-02',"aaa@gmail.com",9875867456,"13,1st street, chennai");
ERROR 1136 (21S01): Column count doesn't match value count at row 1
mysql> insert into empl values(1,"aaa","zzz","Analyst",15000.00,'2020-02-10','2020-02-14','2020-03-02',"aaa@gmail.com",9875867456,"13 1st street chennai");
ERROR 1136 (21S01): Column count doesn't match value count at row 1
mysql> insert into emplo values(1,"aaa","zzz","Analyst",15000.00,'2020-02-10','2020-02-14','2020-03-02',"aaa@gmail.com",9875867456,"13,1st street, chennai");
ERROR 1264 (22003): Out of range value for column 'mobile' at row 1
mysql> insert into emplo values(1,"aaa","zzz","Analyst",15000.00,'2020-02-10','2020-02-14','2020-03-02',"aaa@gmail.com",987586745,"13,1st street, chennai");
Query OK, 1 row affected (0.09 sec)

mysql> alter table emplo modify mobile int(11);
Query OK, 0 rows affected, 1 warning (0.24 sec)
Records: 0  Duplicates: 0  Warnings: 1

mysql> insert into emplo values(1,"aaa","zzz","Analyst",15000.00,'2020-02-10','2020-02-14','2020-03-02',"aaa@gmail.com",9875867456,"13,1st street, chennai");
ERROR 1264 (22003): Out of range value for column 'mobile' at row 1
mysql> alter table emplo modify mobile decimal(10,0);
Query OK, 1 row affected (1.70 sec)
Records: 1  Duplicates: 0  Warnings: 0

mysql> insert into emplo values(1,"aaa","zzz","Analyst",15000.00,'2020-02-10','2020-02-14','2020-03-02',"aaa@gmail.com",9875867456,"13,1st street, chennai");
Query OK, 1 row affected (0.12 sec)

mysql> select * from emplo;
+-------+-----------+----------+-------------+------------+---------------+---------------+---------------+---------------+------------+------------------------+
| empid | firstName | lastName | designation | salary     | interviewDate | reportingDate | releavingDate | email         | mobile     | address                |
+-------+-----------+----------+-------------+------------+---------------+---------------+---------------+---------------+------------+------------------------+
|     1 | aaa       | zzz      | Analyst     | 15000.0000 | 2020-02-10    | 2020-02-14    | 2020-03-02    | aaa@gmail.com |  987586745 | 13,1st street, chennai |
|     1 | aaa       | zzz      | Analyst     | 15000.0000 | 2020-02-10    | 2020-02-14    | 2020-03-02    | aaa@gmail.com | 9875867456 | 13,1st street, chennai |
+-------+-----------+----------+-------------+------------+---------------+---------------+---------------+---------------+------------+------------------------+
2 rows in set (0.00 sec)

mysql> delete from emplo where mobile = 987586745;
Query OK, 1 row affected (0.17 sec)

mysql> select * from emplo;
+-------+-----------+----------+-------------+------------+---------------+---------------+---------------+---------------+------------+------------------------+
| empid | firstName | lastName | designation | salary     | interviewDate | reportingDate | releavingDate | email         | mobile     | address                |
+-------+-----------+----------+-------------+------------+---------------+---------------+---------------+---------------+------------+------------------------+
|     1 | aaa       | zzz      | Analyst     | 15000.0000 | 2020-02-10    | 2020-02-14    | 2020-03-02    | aaa@gmail.com | 9875867456 | 13,1st street, chennai |
+-------+-----------+----------+-------------+------------+---------------+---------------+---------------+---------------+------------+------------------------+
1 row in set (0.00 sec)

mysql> insert into emplo values(2,"bbb","yyy","Programmer",23000.00,'2019-05-02','2019-06-14','2020-02-04',"bbb@gmail.com",9875861234,"15,1st street, chennai");
Query OK, 1 row affected (0.10 sec)

mysql> select * from emplo;
+-------+-----------+----------+-------------+------------+---------------+---------------+---------------+---------------+------------+------------------------+
| empid | firstName | lastName | designation | salary     | interviewDate | reportingDate | releavingDate | email         | mobile     | address                |
+-------+-----------+----------+-------------+------------+---------------+---------------+---------------+---------------+------------+------------------------+
|     1 | aaa       | zzz      | Analyst     | 15000.0000 | 2020-02-10    | 2020-02-14    | 2020-03-02    | aaa@gmail.com | 9875867456 | 13,1st street, chennai |
|     2 | bbb       | yyy      | Programmer  | 23000.0000 | 2019-05-02    | 2019-06-14    | 2020-02-04    | bbb@gmail.com | 9875861234 | 15,1st street, chennai |
+-------+-----------+----------+-------------+------------+---------------+---------------+---------------+---------------+------------+------------------------+
2 rows in set (0.00 sec)

mysql> select * from emplo where designation = "Programmer";
+-------+-----------+----------+-------------+------------+---------------+---------------+---------------+---------------+------------+------------------------+
| empid | firstName | lastName | designation | salary     | interviewDate | reportingDate | releavingDate | email         | mobile     | address                |
+-------+-----------+----------+-------------+------------+---------------+---------------+---------------+---------------+------------+------------------------+
|     2 | bbb       | yyy      | Programmer  | 23000.0000 | 2019-05-02    | 2019-06-14    | 2020-02-04    | bbb@gmail.com | 9875861234 | 15,1st street, chennai |
+-------+-----------+----------+-------------+------------+---------------+---------------+---------------+---------------+------------+------------------------+
1 row in set (0.00 sec)

mysql> create table pet(name varchar(20), owner varchar(20), species varchar(20),gender varchar(20), birth date, death date);
Query OK, 0 rows affected (0.49 sec)

mysql> desc pet;
+---------+-------------+------+-----+---------+-------+
| Field   | Type        | Null | Key | Default | Extra |
+---------+-------------+------+-----+---------+-------+
| name    | varchar(20) | YES  |     | NULL    |       |
| owner   | varchar(20) | YES  |     | NULL    |       |
| species | varchar(20) | YES  |     | NULL    |       |
| gender  | varchar(20) | YES  |     | NULL    |       |
| birth   | date        | YES  |     | NULL    |       |
| death   | date        | YES  |     | NULL    |       |
+---------+-------------+------+-----+---------+-------+
6 rows in set (0.00 sec)

mysql>insert into pet values("Lia","Shiny","Lab cross","Female",'2019-07-29','2030-10-12');
Query OK, 1 row affected (0.07 sec)

mysql> insert into pet values("Brownie","Sharone","Pug","Male",'2006-07-29','2017-10-12');
Query OK, 1 row affected (0.18 sec)

mysql> insert into pet values("Bruno","Jemmie","Cat","Male",'1996-07-29','1998-10-12');
Query OK, 1 row affected (0.12 sec)

mysql> select * from pet;
+---------+---------+-----------+--------+------------+------------+
| name    | owner   | species   | gender | birth      | death      |
+---------+---------+-----------+--------+------------+------------+
| Lia     | Shiny   | Lab cross | Female | 2019-07-29 | 2030-10-12 |
| Brownie | Sharone | Pug       | Male   | 2006-07-29 | 2017-10-12 |
| Bruno   | Jemmie  | Cat       | Male   | 1996-07-29 | 1998-10-12 |
+---------+---------+-----------+--------+------------+------------+
3 rows in set (0.00 sec)

mysql> create table people(id int(5),firstName varchar(20), lastName varchar(20),birth date);
Query OK, 0 rows affected, 1 warning (0.83 sec)

mysql> desc people;
+-----------+-------------+------+-----+---------+-------+
| Field     | Type        | Null | Key | Default | Extra |
+-----------+-------------+------+-----+---------+-------+
| id        | int         | YES  |     | NULL    |       |
| firstName | varchar(20) | YES  |     | NULL    |       |
| lastName  | varchar(20) | YES  |     | NULL    |       |
| birth     | date        | YES  |     | NULL    |       |
+-----------+-------------+------+-----+---------+-------+
4 rows in set (0.00 sec)

mysql> create table order(order_id int(5),ProdName varchar(20),orderDate date);
ERROR 1064 (42000): You have an error in your SQL syntax; check the manual that corresponds to your MySQL server version for the right syntax to use near 'order(order_id int(5),ProdName varchar(20),orderDate date)' at line 1
mysql> create table orders(order_id int(5),ProdName varchar(20),orderDate date);
Query OK, 0 rows affected, 1 warning (0.85 sec)

mysql> desc orders;
+-----------+-------------+------+-----+---------+-------+
| Field     | Type        | Null | Key | Default | Extra |
+-----------+-------------+------+-----+---------+-------+
| order_id  | int         | YES  |     | NULL    |       |
| ProdName  | varchar(20) | YES  |     | NULL    |       |
| orderDate | date        | YES  |     | NULL    |       |
+-----------+-------------+------+-----+---------+-------+
3 rows in set (0.00 sec)

mysql> show tables;
+---------------+
| Tables_in_emp |
+---------------+
| author        |
| categories    |
| contacts      |
| country       |
| datemo        |
| domainname    |
| empl          |
| emplo         |
| employee      |
| orders        |
| people        |
| pet           |
| products      |
| staff         |
+---------------+
14 rows in set (0.00 sec)

mysql> insert into people values(1,"aaa","bbb",'1998-10-06');
Query OK, 1 row affected (0.10 sec)

mysql> insert into people values(2,"ccc","ddd",'1996-07-29');
Query OK, 1 row affected (0.25 sec)

mysql> insert into people values(2,"eee","fff",'1965-04-18');
Query OK, 1 row affected (0.12 sec)

mysql> insert into people values(4,"ggg","hhh",'1968-12-18');
Query OK, 1 row affected (0.13 sec)

mysql> update people set id=3 where firstName = "eee";
Query OK, 1 row affected (0.10 sec)
Rows matched: 1  Changed: 1  Warnings: 0

mysql> select * from people;
+------+-----------+----------+------------+
| id   | firstName | lastName | birth      |
+------+-----------+----------+------------+
|    1 | aaa       | bbb      | 1998-10-06 |
|    2 | ccc       | ddd      | 1996-07-29 |
|    3 | eee       | fff      | 1965-04-18 |
|    4 | ggg       | hhh      | 1968-12-18 |
+------+-----------+----------+------------+
4 rows in set (0.00 sec)

mysql> insert into orders(1, "soap", '2019-05-12');
ERROR 1064 (42000): You have an error in your SQL syntax; check the manual that corresponds to your MySQL server version for the right syntax to use near '1, "soap", '2019-05-12')' at line 1
mysql> insert into orders values(1, "soap", '2019-05-12');
Query OK, 1 row affected (0.12 sec)

mysql> insert into orders values(2, "shampoo", '2020-02-12');
Query OK, 1 row affected (0.11 sec)

mysql> insert into orders values(3, "cream", '2020-02-04');
Query OK, 1 row affected (0.15 sec)

mysql> insert into orders values(4, "honey", '2020-02-04');
Query OK, 1 row affected (0.14 sec)

mysql> select * from orders;
+----------+----------+------------+
| order_id | ProdName | orderDate  |
+----------+----------+------------+
|        1 | soap     | 2019-05-12 |
|        2 | shampoo  | 2020-02-12 |
|        3 | cream    | 2020-02-04 |
|        4 | honey    | 2020-02-04 |
+----------+----------+------------+
4 rows in set (0.04 sec)

mysql> select * from orders where date = '2020-02-04';
ERROR 1054 (42S22): Unknown column 'date' in 'where clause'
mysql> select * from orders where orderDate = '2020-02-04';
+----------+----------+------------+
| order_id | ProdName | orderDate  |
+----------+----------+------------+
|        3 | cream    | 2020-02-04 |
|        4 | honey    | 2020-02-04 |
+----------+----------+------------+
2 rows in set (0.06 sec)

mysql> select * from datemo;
+------+------+------------+
| id   | name | acc_date   |
+------+------+------------+
|    1 | aaa  | 2020-03-02 |
|    2 | bbb  | 2020-03-03 |
|    3 | ccc  | 2020-02-14 |sle
|    4 | ddd  | 2020-02-08 |
|    5 | eee  | 2020-02-04 |
+------+------+------------+
5 rows in set (0.00 sec)

mysql> select * from datemo where acc_date between cast('20200208' as date) and cast('20200302' as date) order by acc_date;
+------+------+------------+
| id   | name | acc_date   |
+------+------+------------+
|    4 | ddd  | 2020-02-08 |
|    3 | ccc  | 2020-02-14 |
|    1 | aaa  | 2020-03-02 |
+------+------+------------+
3 rows in set (0.00 sec)

mysql> select 1 xor 1;
+---------+
| 1 xor 1 |
+---------+
|       0 |
+---------+
1 row in set (0.00 sec)

mysql> select 1 xor 0;
+---------+
| 1 xor 0 |
+---------+
|       1 |
+---------+
1 row in set (0.00 sec)

mysql> select 0 xor 0;
+---------+
| 0 xor 0 |
+---------+
|       0 |
+---------+
1 row in set (0.00 sec)

mysql> select 0 xor null;
+------------+
| 0 xor null |
+------------+
|       NULL |
+------------+
1 row in set (0.00 sec)

mysql> select 1 xor null;
+------------+
| 1 xor null |
+------------+
|       NULL |
+------------+
1 row in set (0.00 sec)

mysql> select 1 xor 1 xor 1 xor 0;
+---------------------+
| 1 xor 1 xor 1 xor 0 |
+---------------------+
|                   1 |
+---------------------+
1 row in set (0.00 sec)

mysql> create table cust(custID int(5), custName varchar(20), ContactName varchar(20), Address varchar(50), City varchar(20), PostalCode int(6), Country varchar(20));
ERROR 1046 (3D000): No database selected
mysql> use emp;
Database changed
mysql> create table cust(custID int(5), custName varchar(20), ContactName varchar(20), Address varchar(50), City varchar(20), PostalCode int(6), Country varchar(20));
Query OK, 0 rows affected, 2 warnings (0.63 sec)

mysql> insert into cust values(1, "Shiny", "SJK", "14,1st Street,Anna Nagar","Chennai",600089,"India");
Query OK, 1 row affected (0.11 sec)

mysql> select * from cust;
+--------+----------+-------------+--------------------------+---------+------------+---------+
| custID | custName | ContactName | Address                  | City    | PostalCode | Country |
+--------+----------+-------------+--------------------------+---------+------------+---------+
|      1 | Shiny    | SJK         | 14,1st Street,Anna Nagar | Chennai |     600089 | India   |
+--------+----------+-------------+--------------------------+---------+------------+---------+
1 row in set (0.00 sec)

mysql> insert into cust values(2, "Jasmine", "JK", "173,1st Street,Sathya Nagar","Chennai",600089,"India");
Query OK, 1 row affected (0.15 sec)

mysql> select * from cust;
+--------+----------+-------------+-----------------------------+---------+------------+---------+
| custID | custName | ContactName | Address                     | City    | PostalCode | Country |
+--------+----------+-------------+-----------------------------+---------+------------+---------+
|      1 | Shiny    | SJK         | 14,1st Street,Anna Nagar    | Chennai |     600089 | India   |
|      2 | Jasmine  | JK          | 173,1st Street,Sathya Nagar | Chennai |     600089 | India   |
+--------+----------+-------------+-----------------------------+---------+------------+---------+
2 rows in set (0.00 sec)

mysql> insert into cust values(3, "Jasper", "Dsouza", "14,9th Street,Anna Nagar","Chennai",600089,"India");
Query OK, 1 row affected (0.12 sec)

mysql> insert into cust values(4, "Jas", "Diana", "14,9th Street,sathya Nagar","Tirunelveli",600456,"India");
Query OK, 1 row affected (0.14 sec)

mysql> insert into cust values(5, "Jelena", "Salome", "14,9th Street,michale colony","Dallas",600456,"Texas");
Query OK, 1 row affected (0.13 sec)

mysql> select * from cust;
+--------+----------+-------------+------------------------------+-------------+------------+---------+
| custID | custName | ContactName | Address                      | City        | PostalCode | Country |
+--------+----------+-------------+------------------------------+-------------+------------+---------+
|      1 | Shiny    | SJK         | 14,1st Street,Anna Nagar     | Chennai     |     600089 | India   |
|      2 | Jasmine  | JK          | 173,1st Street,Sathya Nagar  | Chennai     |     600089 | India   |
|      3 | Jasper   | Dsouza      | 14,9th Street,Anna Nagar     | Chennai     |     600089 | India   |
|      4 | Jas      | Diana       | 14,9th Street,sathya Nagar   | Tirunelveli |     600456 | India   |
|      5 | Jelena   | Salome      | 14,9th Street,michale colony | Dallas      |     600456 | Texas   |
+--------+----------+-------------+------------------------------+-------------+------------+---------+
5 rows in set (0.00 sec)

mysql> select * from cust group by city;
+--------+----------+-------------+------------------------------+-------------+------------+---------+
| custID | custName | ContactName | Address                      | City        | PostalCode | Country |
+--------+----------+-------------+------------------------------+-------------+------------+---------+
|      1 | Shiny    | SJK         | 14,1st Street,Anna Nagar     | Chennai     |     600089 | India   |
|      4 | Jas      | Diana       | 14,9th Street,sathya Nagar   | Tirunelveli |     600456 | India   |
|      5 | Jelena   | Salome      | 14,9th Street,michale colony | Dallas      |     600456 | Texas   |
+--------+----------+-------------+------------------------------+-------------+------------+---------+
3 rows in set (0.01 sec)

mysql> select custName,City from cust group by City;
+----------+-------------+
| custName | City        |
+----------+-------------+
| Shiny    | Chennai     |
| Jas      | Tirunelveli |
| Jelena   | Dallas      |
+----------+-------------+
3 rows in set (0.00 sec)

mysql> use emp;
Database changed
mysql> show tables;
+---------------+
| Tables_in_emp |
+---------------+
| author        |
| categories    |
| contacts      |
| country       |
| cust          |
| customers     |
| datemo        |
| domainname    |
| emp1          |
| empl          |
| emplo         |
| employee      |
| orders        |
| people        |
| pet           |
| products      |
| staff         |
| website       |
+---------------+
18 rows in set (0.00 sec)

mysql> select * from customers;
+------+---------+--------+------+
| id   | name    | salary | code |
+------+---------+--------+------+
|    1 | Shiny   |  50000 | A    |
|    2 | Jasmine |  40000 | B    |
|    3 | Jerrina |  30000 | C    |
|    4 | Jasper  |  25000 | D    |
|    5 | Amy     |  30000 | E    |
+------+---------+--------+------+
5 rows in set (0.00 sec)

mysql> select ifnull((select name from customers where id = 3),'NULL') as FirstName;
+-----------+
| FirstName |
+-----------+
| Jerrina   |
+-----------+
1 row in set (0.00 sec)

mysql> update customers set name = "NULL" where id = 3;
Query OK, 1 row affected (0.10 sec)
Rows matched: 1  Changed: 1  Warnings: 0

mysql> select * from customers;
+------+---------+--------+------+
| id   | name    | salary | code |
+------+---------+--------+------+
|    1 | Shiny   |  50000 | A    |
|    2 | Jasmine |  40000 | B    |
|    3 | NULL    |  30000 | C    |
|    4 | Jasper  |  25000 | D    |
|    5 | Amy     |  30000 | E    |
+------+---------+--------+------+
5 rows in set (0.00 sec)

mysql> select ifnull((select name from customers where id = 3),'NULL') as FirstName;
+-----------+
| FirstName |
+-----------+
| NULL      |
+-----------+
1 row in set (0.00 sec)

mysql> select 3 in (1,2,3,4,5,6);
+--------------------+
| 3 in (1,2,3,4,5,6) |
+--------------------+
|                  1 |
+--------------------+
1 row in set (0.00 sec)

mysql> select 3 in (1,2,3,4,5,6,3);
+----------------------+
| 3 in (1,2,3,4,5,6,3) |
+----------------------+
|                    1 |
+----------------------+
1 row in set (0.00 sec)

mysql> select 3 in (1,2,4,5,6);
+------------------+
| 3 in (1,2,4,5,6) |
+------------------+
|                0 |
+------------------+
1 row in set (0.00 sec)

mysql> select * from customers where id in (1,2,3);
+------+---------+--------+------+
| id   | name    | salary | code |
+------+---------+--------+------+
|    1 | Shiny   |  50000 | A    |
|    2 | Jasmine |  40000 | B    |
|    3 | NULL    |  30000 | C    |
+------+---------+--------+------+
3 rows in set (0.00 sec)

mysql> select * from customers where id in (2,3);
+------+---------+--------+------+
| id   | name    | salary | code |
+------+---------+--------+------+
|    2 | Jasmine |  40000 | B    |
|    3 | NULL    |  30000 | C    |
+------+---------+--------+------+
2 rows in set (0.00 sec)

mysql> select ((10,2) in (1,2),(10,2),(100,200));
ERROR 1241 (21000): Operand should contain 2 column(s)
mysql> select (10,2) in ((1,2),(10,2),(100,200));
+------------------------------------+
| (10,2) in ((1,2),(10,2),(100,200)) |
+------------------------------------+
|                                  1 |
+------------------------------------+
1 row in set (0.00 sec)

mysql> select 4 in ('1','2','3','4');
+------------------------+
| 4 in ('1','2','3','4') |
+------------------------+
|                      1 |
+------------------------+
1 row in set (0.00 sec)

mysql> select 'abc' in ('xyz','abc','a');
+----------------------------+
| 'abc' in ('xyz','abc','a') |
+----------------------------+
|                          1 |
+----------------------------+
1 row in set (0.00 sec)

mysql> select 'a' in ('xyz','abc','azy');
+----------------------------+
| 'a' in ('xyz','abc','azy') |
+----------------------------+
|                          0 |
+----------------------------+
1 row in set (0.00 sec)

mysql> select 4 in (1,2,3,4,'5');
+--------------------+
| 4 in (1,2,3,4,'5') |
+--------------------+
|                  1 |
+--------------------+
1 row in set (0.00 sec)

mysql> select 4 not in (2,4,5,8);
+--------------------+
| 4 not in (2,4,5,8) |
+--------------------+
|                  0 |
+--------------------+
1 row in set (0.00 sec)

mysql> select 4 not in (2,3,5,8);
+--------------------+
| 4 not in (2,3,5,8) |
+--------------------+
|                  1 |
+--------------------+
1 row in set (0.00 sec)

mysql> select * from customers where id not in (2,3);
+------+--------+--------+------+
| id   | name   | salary | code |
+------+--------+--------+------+
|    1 | Shiny  |  50000 | A    |
|    4 | Jasper |  25000 | D    |
|    5 | Amy    |  30000 | E    |
+------+--------+--------+------+
3 rows in set (0.00 sec)

mysql> select 1 is true;
+-----------+
| 1 is true |
+-----------+
|         1 |
+-----------+
1 row in set (0.00 sec)

mysql> select 0 is true,0 is false;
+-----------+------------+
| 0 is true | 0 is false |
+-----------+------------+
|         0 |          1 |
+-----------+------------+
1 row in set (0.00 sec)

mysql> select 1 is true,0 is false,null is unknown;
+-----------+------------+-----------------+
| 1 is true | 0 is false | null is unknown |
+-----------+------------+-----------------+
|         1 |          1 |               1 |
+-----------+------------+-----------------+
1 row in set (0.00 sec)

mysql> select id,name,salary,salary is true,salary is false, salary is unknown,code from customers;
+------+---------+--------+----------------+-----------------+-------------------+------+
| id   | name    | salary | salary is true | salary is false | salary is unknown | code |
+------+---------+--------+----------------+-----------------+-------------------+------+
|    1 | Shiny   |  50000 |              1 |               0 |                 0 | A    |
|    2 | Jasmine |  40000 |              1 |               0 |                 0 | B    |
|    3 | NULL    |  30000 |              1 |               0 |                 0 | C    |
|    4 | Jasper  |  25000 |              1 |               0 |                 0 | D    |
|    5 | Amy     |  30000 |              1 |               0 |                 0 | E    |
+------+---------+--------+----------------+-----------------+-------------------+------+
5 rows in set (0.00 sec)

mysql> update customers salary = null where name = 'null';
ERROR 1064 (42000): You have an error in your SQL syntax; check the manual that corresponds to your MySQL server version for the right syntax to use near '= null where name = 'null'' at line 1
mysql> update customers salary = null where name = "NULL";
ERROR 1064 (42000): You have an error in your SQL syntax; check the manual that corresponds to your MySQL server version for the right syntax to use near '= null where name = "NULL"' at line 1
mysql> update customers salary = 'null' where name = "NULL";
ERROR 1064 (42000): You have an error in your SQL syntax; check the manual that corresponds to your MySQL server version for the right syntax to use near '= 'null' where name = "NULL"' at line 1
mysql> update customers set salary = 'null' where name = "NULL";
ERROR 1366 (HY000): Incorrect integer value: 'null' for column 'salary' at row 3
mysql> update customers set salary = null where name = "NULL";
Query OK, 1 row affected (0.15 sec)
Rows matched: 1  Changed: 1  Warnings: 0

mysql> select * from customers;
+------+---------+--------+------+
| id   | name    | salary | code |
+------+---------+--------+------+
|    1 | Shiny   |  50000 | A    |
|    2 | Jasmine |  40000 | B    |
|    3 | NULL    |   NULL | C    |
|    4 | Jasper  |  25000 | D    |
|    5 | Amy     |  30000 | E    |
+------+---------+--------+------+
5 rows in set (0.00 sec)

mysql> select id,name,salary,salary is true,salary is false, salary is unknown,code from customers;
+------+---------+--------+----------------+-----------------+-------------------+------+
| id   | name    | salary | salary is true | salary is false | salary is unknown | code |
+------+---------+--------+----------------+-----------------+-------------------+------+
|    1 | Shiny   |  50000 |              1 |               0 |                 0 | A    |
|    2 | Jasmine |  40000 |              1 |               0 |                 0 | B    |
|    3 | NULL    |   NULL |              0 |               0 |                 1 | C    |
|    4 | Jasper  |  25000 |              1 |               0 |                 0 | D    |
|    5 | Amy     |  30000 |              1 |               0 |                 0 | E    |
+------+---------+--------+----------------+-----------------+-------------------+------+
5 rows in set (0.00 sec)

mysql> select salary from customers where name is null;
Empty set (0.00 sec)

mysql> select salary from customers where salary is null;
+--------+
| salary |
+--------+
|   NULL |
+--------+
1 row in set (0.00 sec)

mysql> select salary from customers where salary is not null;
+--------+
| salary |
+--------+
|  50000 |
|  40000 |
|  25000 |
|  30000 |
+--------+
4 rows in set (0.00 sec)

